{
  "$schema": "https://json-schema.org/draft/2020-12/schema",
  "$id": "https://contracts.dubsar.invalid/agent-context/v1/agent-context.schema.json",
  "title": "dubsar.agent-context/1",
  "type": "object",
  "additionalProperties": false,
  "required": [
    "format",
    "kind",
    "authority",
    "content_trust",
    "text_role",
    "truth",
    "captured_at",
    "context_digest",
    "bot_id",
    "profile_id",
    "mission_id",
    "project_id",
    "identity_source",
    "manual_keys_used",
    "resolution",
    "resolved_focus_key",
    "resolved_subject_key",
    "namespaces_searched",
    "namespaces_refused",
    "memory",
    "my_work",
    "operational_context",
    "coverage",
    "limits",
    "bounds"
  ],
  "properties": {
    "format": {
      "const": "dubsar.agent-context/1"
    },
    "kind": {
      "const": "agent_context_view"
    },
    "authority": {
      "const": "none"
    },
    "content_trust": {
      "const": "advisory_data"
    },
    "text_role": {
      "const": "data"
    },
    "truth": {
      "const": "not_selected"
    },
    "captured_at": {
      "anyOf": [
        {
          "$ref": "#/$defs/time"
        },
        {
          "type": "null"
        }
      ]
    },
    "context_digest": {
      "$ref": "#/$defs/digest"
    },
    "bot_id": {
      "$ref": "#/$defs/token"
    },
    "profile_id": {
      "$ref": "#/$defs/token"
    },
    "mission_id": {
      "$ref": "#/$defs/token"
    },
    "project_id": {
      "$ref": "#/$defs/token"
    },
    "identity_source": {
      "const": "profile_name"
    },
    "manual_keys_used": {
      "const": false
    },
    "resolution": {
      "const": "trusted_mapping"
    },
    "resolved_focus_key": {
      "$ref": "#/$defs/text256"
    },
    "resolved_subject_key": {
      "$ref": "#/$defs/text256"
    },
    "namespaces_searched": {
      "type": "array",
      "maxItems": 16,
      "items": {
        "$ref": "#/$defs/text256"
      }
    },
    "namespaces_refused": {
      "type": "array",
      "maxItems": 16,
      "items": {
        "$ref": "#/$defs/text256"
      }
    },
    "memory": {
      "$ref": "#/$defs/memorySource"
    },
    "my_work": {
      "$ref": "#/$defs/myWorkSource"
    },
    "operational_context": {
      "$ref": "#/$defs/ocSource"
    },
    "coverage": {
      "$ref": "#/$defs/coverage"
    },
    "limits": {
      "type": "array",
      "maxItems": 64,
      "items": {
        "$ref": "#/$defs/limit"
      }
    },
    "bounds": {
      "$ref": "#/$defs/bounds"
    },
    "executable": {
      "const": false
    },
    "automation_results": {
      "$ref": "automation-results.schema.json"
    },
    "accepted_context": {
      "type": "object",
      "additionalProperties": false,
      "required": [
        "format",
        "availability",
        "source",
        "bindings",
        "omitted_count",
        "truncated",
        "limits",
        "authority",
        "executable"
      ],
      "properties": {
        "format": {
          "const": "dubsar.agent-context.accepted-context/1"
        },
        "availability": {
          "$ref": "#/$defs/availability"
        },
        "source": {
          "const": "get_mission_context"
        },
        "bindings": {
          "type": "array",
          "maxItems": 10,
          "items": {
            "type": "object",
            "additionalProperties": false,
            "required": [
              "binding",
              "status",
              "target",
              "memory_supports",
              "context_refs",
              "limits",
              "authority",
              "executable"
            ],
            "properties": {
              "binding": {
                "type": "object"
              },
              "status": {
                "enum": [
                  "matched",
                  "changed",
                  "missing",
                  "unverified"
                ]
              },
              "target": {
                "anyOf": [
                  {
                    "type": "object"
                  },
                  {
                    "type": "null"
                  }
                ]
              },
              "memory_supports": {
                "type": "array",
                "maxItems": 20,
                "items": {
                  "type": "object"
                }
              },
              "context_refs": {
                "type": "array",
                "maxItems": 20,
                "items": {
                  "type": "string"
                }
              },
              "limits": {
                "type": "array",
                "maxItems": 32,
                "items": {
                  "$ref": "#/$defs/limit"
                }
              },
              "authority": {
                "const": "none"
              },
              "executable": {
                "const": false
              }
            }
          }
        },
        "omitted_count": {
          "type": "integer",
          "minimum": 0
        },
        "truncated": {
          "type": "boolean"
        },
        "limits": {
          "type": "array",
          "maxItems": 32,
          "items": {
            "$ref": "#/$defs/limit"
          }
        },
        "authority": {
          "const": "none"
        },
        "executable": {
          "const": false
        }
      }
    }
  },
  "$defs": {
    "time": {
      "type": "string",
      "pattern": "^\\d{4}-\\d{2}-\\d{2}T\\d{2}:\\d{2}:\\d{2}\\.\\d{3}Z$"
    },
    "digest": {
      "type": "string",
      "pattern": "^[0-9a-f]{64}$"
    },
    "token": {
      "type": "string",
      "minLength": 1,
      "maxLength": 128,
      "pattern": "^[^\\u0000-\\u001f]+$"
    },
    "text256": {
      "type": "string",
      "minLength": 1,
      "maxLength": 256,
      "pattern": "^[^\\u0000-\\u001f]+$"
    },
    "nullableRef": {
      "anyOf": [
        {
          "$ref": "#/$defs/text256"
        },
        {
          "type": "null"
        }
      ]
    },
    "availability": {
      "enum": [
        "available",
        "missing",
        "unavailable",
        "not_applicable"
      ]
    },
    "freshness": {
      "enum": [
        "current",
        "stale",
        "unknown"
      ]
    },
    "limit": {
      "type": "object",
      "additionalProperties": false,
      "required": [
        "component",
        "code",
        "detail"
      ],
      "properties": {
        "component": {
          "enum": [
            "memory",
            "my_work",
            "operational_context",
            "context",
            "accepted_context"
          ]
        },
        "code": {
          "type": "string",
          "minLength": 1,
          "maxLength": 96,
          "pattern": "^[A-Z0-9_]+$"
        },
        "detail": {
          "type": "string",
          "minLength": 1,
          "maxLength": 256,
          "pattern": "^[^\\u0000-\\u001f]+$"
        }
      }
    },
    "provenance": {
      "type": "object",
      "additionalProperties": false,
      "required": [
        "source_id",
        "content_digest",
        "evidence_ref",
        "mywork_mission_ref",
        "oc_observation_ref"
      ],
      "properties": {
        "source_id": {
          "$ref": "#/$defs/nullableRef"
        },
        "content_digest": {
          "anyOf": [
            {
              "$ref": "#/$defs/digest"
            },
            {
              "type": "null"
            }
          ]
        },
        "evidence_ref": {
          "$ref": "#/$defs/nullableRef"
        },
        "mywork_mission_ref": {
          "$ref": "#/$defs/nullableRef"
        },
        "oc_observation_ref": {
          "$ref": "#/$defs/nullableRef"
        }
      }
    },
    "memoryRelation": {
      "type": "object",
      "additionalProperties": false,
      "required": [
        "depth",
        "namespace_id",
        "predicate",
        "relation_id",
        "statement",
        "subject_key",
        "supersedes",
        "provenance"
      ],
      "properties": {
        "depth": {
          "const": 1
        },
        "namespace_id": {
          "$ref": "#/$defs/text256"
        },
        "predicate": {
          "$ref": "#/$defs/text256"
        },
        "relation_id": {
          "$ref": "#/$defs/text256"
        },
        "statement": {
          "type": "string",
          "minLength": 1,
          "maxLength": 8192
        },
        "subject_key": {
          "$ref": "#/$defs/text256"
        },
        "supersedes": {
          "$ref": "#/$defs/nullableRef"
        },
        "provenance": {
          "$ref": "#/$defs/provenance"
        }
      }
    },
    "memorySource": {
      "type": "object",
      "additionalProperties": false,
      "required": [
        "api",
        "availability",
        "freshness",
        "source_contract",
        "relations",
        "truncated",
        "v1_fallback",
        "limits"
      ],
      "properties": {
        "api": {
          "const": "v2"
        },
        "availability": {
          "$ref": "#/$defs/availability"
        },
        "freshness": {
          "$ref": "#/$defs/freshness"
        },
        "source_contract": {
          "const": "memory-plane.v2/context-view"
        },
        "relations": {
          "type": "array",
          "maxItems": 20,
          "items": {
            "$ref": "#/$defs/memoryRelation"
          }
        },
        "truncated": {
          "type": "boolean"
        },
        "v1_fallback": {
          "const": false
        },
        "limits": {
          "type": "array",
          "maxItems": 32,
          "items": {
            "$ref": "#/$defs/limit"
          }
        }
      }
    },
    "ticket": {
      "type": "object",
      "additionalProperties": false,
      "required": [
        "state",
        "ticket_id",
        "title"
      ],
      "properties": {
        "state": {
          "$ref": "#/$defs/text256"
        },
        "ticket_id": {
          "$ref": "#/$defs/text256"
        },
        "title": {
          "type": "string",
          "minLength": 1,
          "maxLength": 300
        }
      }
    },
    "myWorkSource": {
      "type": "object",
      "additionalProperties": false,
      "required": [
        "availability",
        "freshness",
        "source",
        "source_contract",
        "truncated",
        "limits"
      ],
      "properties": {
        "availability": {
          "$ref": "#/$defs/availability"
        },
        "freshness": {
          "$ref": "#/$defs/freshness"
        },
        "source": {
          "enum": [
            "list_tickets",
            "get_mission_context"
          ]
        },
        "source_contract": {
          "enum": [
            "dubsar.my-work-tickets/1",
            "dubsar.my-work-mission-view/1"
          ]
        },
        "tickets": {
          "type": "array",
          "maxItems": 100,
          "items": {
            "$ref": "#/$defs/ticket"
          }
        },
        "truncated": {
          "type": "boolean"
        },
        "limits": {
          "type": "array",
          "maxItems": 32,
          "items": {
            "$ref": "#/$defs/limit"
          }
        },
        "mission": {
          "anyOf": [
            {
              "$ref": "my-work-mission-view.schema.json"
            },
            {
              "type": "null"
            }
          ]
        }
      },
      "oneOf": [
        {
          "properties": {
            "source": {
              "const": "list_tickets"
            },
            "source_contract": {
              "const": "dubsar.my-work-tickets/1"
            }
          },
          "required": [
            "tickets"
          ],
          "not": {
            "required": [
              "mission"
            ]
          }
        },
        {
          "properties": {
            "source": {
              "const": "get_mission_context"
            },
            "source_contract": {
              "const": "dubsar.my-work-mission-view/1"
            }
          },
          "required": [
            "mission"
          ],
          "not": {
            "required": [
              "tickets"
            ]
          }
        }
      ]
    },
    "ocSource": {
      "type": "object",
      "additionalProperties": false,
      "required": [
        "availability",
        "freshness",
        "source",
        "source_contract",
        "truncated",
        "view",
        "limits"
      ],
      "properties": {
        "availability": {
          "$ref": "#/$defs/availability"
        },
        "freshness": {
          "$ref": "#/$defs/freshness"
        },
        "source": {
          "const": "get_oc_context_view"
        },
        "source_contract": {
          "enum": [
            "dubsar.my-work-oc-context-view/1",
            "dubsar.my-work-oc-context-view/2",
            "unavailable",
            "dubsar.my-work-oc-context-read/1"
          ]
        },
        "truncated": {
          "type": "boolean"
        },
        "view": {
          "anyOf": [
            {
              "type": "object"
            },
            {
              "type": "null"
            }
          ]
        },
        "limits": {
          "type": "array",
          "maxItems": 32,
          "items": {
            "$ref": "#/$defs/limit"
          }
        },
        "selection": {
          "anyOf": [
            {
              "$ref": "my-work-oc-selection.schema.json"
            },
            {
              "type": "object",
              "additionalProperties": false,
              "required": [
                "selection_id",
                "mapping_version",
                "resource_ref",
                "property",
                "relation_depth",
                "source"
              ],
              "properties": {
                "selection_id": {
                  "anyOf": [
                    {
                      "type": "string",
                      "minLength": 1,
                      "maxLength": 128
                    },
                    {
                      "type": "null"
                    }
                  ]
                },
                "mapping_version": {
                  "const": 1
                },
                "resource_ref": {
                  "anyOf": [
                    {
                      "type": "string",
                      "minLength": 1,
                      "maxLength": 256
                    },
                    {
                      "type": "null"
                    }
                  ]
                },
                "property": {
                  "anyOf": [
                    {
                      "type": "string",
                      "minLength": 1,
                      "maxLength": 256
                    },
                    {
                      "type": "null"
                    }
                  ]
                },
                "relation_depth": {
                  "anyOf": [
                    {
                      "type": "integer",
                      "minimum": 0,
                      "maximum": 1
                    },
                    {
                      "type": "null"
                    }
                  ]
                },
                "source": {
                  "const": "trusted_mapping"
                }
              }
            },
            {
              "type": "null"
            }
          ]
        }
      }
    },
    "coverage": {
      "type": "object",
      "additionalProperties": false,
      "required": [
        "status",
        "selection_method",
        "capabilities"
      ],
      "properties": {
        "status": {
          "enum": [
            "complete",
            "partial",
            "unavailable"
          ]
        },
        "selection_method": {
          "const": "trusted_profile_readonly_ports"
        },
        "capabilities": {
          "type": "array",
          "minItems": 1,
          "maxItems": 3,
          "uniqueItems": true,
          "items": {
            "enum": [
              "memory",
              "my_work",
              "operational_context"
            ]
          }
        }
      }
    },
    "bounds": {
      "type": "object",
      "additionalProperties": false,
      "required": [
        "depth",
        "max_depth",
        "max_relations",
        "max_render_chars",
        "max_serialized_bytes",
        "ordering",
        "relation_count",
        "render_chars",
        "serialized_bytes"
      ],
      "properties": {
        "depth": {
          "const": 1
        },
        "max_depth": {
          "const": 1
        },
        "max_relations": {
          "const": 20
        },
        "max_render_chars": {
          "const": 9000
        },
        "max_serialized_bytes": {
          "const": 32768
        },
        "ordering": {
          "type": "string",
          "minLength": 1,
          "maxLength": 256
        },
        "relation_count": {
          "type": "integer",
          "minimum": 0,
          "maximum": 20
        },
        "render_chars": {
          "type": "integer",
          "minimum": 0,
          "maximum": 9000
        },
        "serialized_bytes": {
          "type": "integer",
          "minimum": 0,
          "maximum": 32768
        }
      }
    }
  }
}
